### ISSUE TITLE
wireguard not listening on port 51820

### ISSUE THREAD

**Issue by Janevski** [ngoduykhanh/wireguard-ui#301]
I am using wireguard-ui in docker and i can't get it to work, because when the client is trying to connect to UDP 51820, the server responds with ICMP port unreachable, which means nothing is listening there.
I've checked on the server and within the wgui container, nothing is listening on UDP 51820. And there is no wg0 interface.

19:00:39.833454 eth0  In  IP 37.25.86.42.61773 > 5.75.196.218.51820: UDP, length 148
19:00:39.833517 eth0  Out IP 5.75.196.218 > 37.25.86.42: ICMP 5.75.196.218 udp port 51820 unreachable, length 184

My docker-compose is as follows:
```
...
  wgui:
    build: build/wireguard-ui
    image: wireguard-ui:latest
    container_name: wgui
    hostname: wgui
    restart: always
    #logging:
    #    driver: none
    logging:
      driver: gelf
      options:
        gelf-address: "udp://localhost:9992"
    #logging:
    #  options:
    #    max-size: "100m"
    #    max-file: "3"
    deploy:
      replicas: 1
      resources:
        limits:
          #cpus: '2'
          memory: ${ENV_RAM_LIMIT}
    cap_add:
      - NET_ADMIN
      - SYS_MODULE
    environment:
      - TZ=${ENV_TIMEZONE}
      - SENDGRID_API_KEY=${ENV_SENDGRID_API_KEY}
      - EMAIL_FROM_ADDRESS=${ENV_EMAIL_FROM_ADDRESS}
      - EMAIL_FROM_NAME=${ENV_EMAIL_FROM_NAME}
      - SESSION_SECRET=${ENV_SESSION_SECRET}
      - WGUI_USERNAME=${ENV_WGUI_USERNAME}
      - WGUI_PASSWORD=${ENV_WGUI_PASSWORD}
      #- WG_CONF_TEMPLATE=${ENV_WG_CONF_TEMPLATE}
      - WGUI_MANAGE_START=false
      - WGUI_MANAGE_RESTART=false
    volumes:
       - ${ENV_DIR}/${ENV_PROJECT}/vpn_db:/app/db
       - ${ENV_DIR}/${ENV_PROJECT}/vpn_config:/etc/wireguard
    #extra_hosts:
    #  - "host.docker.internal:host-gateway"
    network_mode: host
    #depends_on:
    #  - db
    ...
```

Description:	Ubuntu 22.04.1 LTS
Docker version 20.10.22, build 3a2c30b
docker-compose version 1.29.2, build 5becea4c
wireguard-tools v1.0.20210914 - https://git.zx2c4.com/wireguard-tools/

PS: The wgui logs don't say anything particular, at all.
```
Wireguard UI
App Version : development
Git Commit : N/A
Git Ref : N/A
Build Time : 01-15-2023 18:46:58
Git Repo : https://github.com/ngoduykhanh/wireguard-ui
Authentication : true
Bind address : 0.0.0.0:5000
Email from : no-reply@[REDACTED]
Email from name : vpn
Custom wg.conf :
Base path : /
⇨ http server started on [::]:5000
{"time":"2023-01-15T18:47:28.131289268Z","id":"","remote_ip":"127.0.0.1","host":"127.0.0.1:5000","method":"GET","uri":"/_health","user_agent":"Wget","status":200,"error":"","latency":4990,"latency_human":"4.99µs","bytes_in":0,"bytes_out":2}
{"time":"2023-01-15T18:47:58.184724738Z","id":"","remote_ip":"127.0.0.1","host":"127.0.0.1:5000","method":"GET","uri":"/_health","user_agent":"Wget","status":200,"error":"","latency":26833,"latency_human":"26.833µs","bytes_in":0,"bytes_out":2}
{"time":"2023-01-15T18:48:28.257660392Z","id":"","remote_ip":"127.0.0.1","host":"127.0.0.1:5000","method":"GET","uri":"/_health","user_agent":"Wget","status":200,"error":"","latency":54764,"latency_human":"54.764µs","bytes_in":0,"bytes_out":2}
{"time":"2023-01-15T18:48:58.327378353Z","id":"","remote_ip":"127.0.0.1","host":"127.0.0.1:5000","method":"GET","uri":"/_health","user_agent":"Wget","status":200,"error":"","latency":26350,"latency_human":"26.35µs","bytes_in":0,"bytes_out":2}
{"time":"2023-01-15T18:49:28.401595279Z","id":"","remote_ip":"127.0.0.1","host":"127.0.0.1:5000","method":"GET","uri":"/_health","user_agent":"Wget","status":200,"error":"","latency":25661,"latency_human":"25.661µs","bytes_in":0,"bytes_out":2}
{"time":"2023-01-15T18:49:58.461058959Z","id":"","remote_ip":"127.0.0.1","host":"127.0.0.1:5000","method":"GET","uri":"/_health","user_agent":"Wget","status":200,"error":"","latency":29346,"latency_human":"29.346µs","bytes_in":0,"bytes_out":2}
{"time":"2023-01-15T18:50:28.549025544Z","id":"","remote_ip":"127.0.0.1","host":"127.0.0.1:5000","method":"GET","uri":"/_health","user_agent":"Wget","status":200,"error":"","latency":37923,"latency_human":"37.923µs","bytes_in":0,"bytes_out":2}
{"time":"2023-01-15T18:50:58.622828458Z","id":"","remote_ip":"127.0.0.1","host":"127.0.0.1:5000","method":"GET","uri":"/_health","user_agent":"Wget","status":200,"error":"","latency":25770,"latency_human":"25.77µs","bytes_in":0,"bytes_out":2}
{"time":"2023-01-15T18:51:28.686035737Z","id":"","remote_ip":"127.0.0.1","host":"127.0.0.1:5000","method":"GET","uri":"/_health","user_agent":"Wget","status":200,"error":"","latency":30328,"latency_human":"30.328µs","bytes_in":0,"bytes_out":2}
```

**Comment by ByteDream** [comment]
Do you have a wireguard service inside of your docker compose file? The wireguard-ui image only delivers the gui, wireguard itself must be configured separately.

**Comment by Janevski** [comment]
No i don't have wireguard servce within the compose. Which one should i use? How do i connect it with wireguard-ui?

I have wireguard on the system itself, just installed via apt-get install -y wireguard.

**Comment by Janevski** [comment]
I have set the wireguard volume mount pount from:
- ${ENV_DIR}/${ENV_PROJECT}/vpn_config:/etc/wireguard
to:
/etc/wireguard:/etc/wireguard

Then i enabled the following env variables:
      - WGUI_MANAGE_START=true
      - WGUI_MANAGE_RESTART=true

Then disable enable the client profile and applied server config.

After which i have noticed that traffic started flowing, now i need to figure out, why there are no responses towards the client:
```
03:05:04.680628 eth0  In  IP 37.25.86.42.62267 > 5.75.196.218.51820: UDP, length 112
03:05:04.680628 eth0  In  IP 37.25.86.42.62267 > 5.75.196.218.51820: UDP, length 112
03:05:04.680648 wg0   In  IP 10.252.1.1.34397 > 8.8.8.8.53: 52459+ A? api.brs.intl.miui.com. (39)
03:05:04.680648 wg0   In  IP 10.252.1.1.38103 > 8.8.8.8.53: 38160+ A? api.brs.intl.miui.com. (39)
03:05:04.850396 eth0  In  IP 37.25.86.42.62267 > 5.75.196.218.51820: UDP, length 112
03:05:04.850448 wg0   In  IP 10.252.1.1.45464 > 8.8.8.8.53: 38864+ A? googleads.g.doubleclick.net. (45)
03:05:05.912423 eth0  In  IP 37.25.86.42.62267 > 5.75.196.218.51820: UDP, length 96
03:05:05.912497 wg0   In  IP 10.252.1.1.52686 > 8.8.8.8.53: 19563+ A? www.google.com. (32)
03:05:05.925355 eth0  In  IP 37.25.86.42.62267 > 5.75.196.218.51820: UDP, length 148
03:05:05.925572 eth0  Out IP 5.75.196.218.51820 > 37.25.86.42.62267: UDP, length 92
03:05:06.009217 eth0  Out IP 5.75.196.218.53090 > 49.12.212.136.443: Flags [P.], seq 2907:3876, ack 754, win 6730, options [nop,nop,TS val 2474923294 ecr 1013768263], length 969
03:05:06.010469 eth0  In  IP 37.25.86.42.62267 > 5.75.196.218.51820: UDP, length 32
03:05:06.016071 eth0  In  IP 49.12.212.136.443 > 5.75.196.218.53090: Flags [P.], seq 754:1005, ack 3876, win 10106, options [nop,nop,TS val 1013771269 ecr 2474923294], length 251
03:05:06.016090 eth0  Out IP 5.75.196.218.53090 > 49.12.212.136.443: Flags [.], ack 1005, win 6730, options [nop,nop,TS val 2474923301 ecr 1013771269], length 0
03:05:06.035426 eth0  In  IP 37.25.86.42.62267 > 5.75.196.218.51820: UDP, length 160
03:05:06.035462 wg0   In  IP 10.252.1.1.19916 > 8.8.8.8.53: 49138+ A? fr-app-chat-global-xiaomi-net-1516654448.eu-central-1.elb.amazonaws.com. (89)
03:05:06.892403 eth0  In  IP 37.25.86.42.62267 > 5.75.196.218.51820: UDP, length 112
03:05:06.892456 wg0   In  IP 10.252.1.1.59170 > 8.8.8.8.53: 64784+ A? googleads.g.doubleclick.net. (45)
03:05:07.030432 eth0  In  IP 37.25.86.42.62267 > 5.75.196.218.51820: UDP, length 96
03:05:07.030498 wg0   In  IP 10.252.1.1.13232 > 1.1.1.1.53: 30122+ A? www.google.com. (32)
03:05:07.195419 eth0  In  IP 37.25.86.42.62267 > 5.75.196.218.51820: UDP, length 112
03:05:07.195463 wg0   In  IP 10.252.1.1.28819 > 1.1.1.1.53: 16925+ A? api.ad.intl.xiaomi.com. (40)
03:05:07.195591 eth0  In  IP 37.25.86.42.62267 > 5.75.196.218.51820: UDP, length 112
03:05:07.195621 wg0   In  IP 10.252.1.1.48927 > 1.1.1.1.53: 38712+ A? api.ad.intl.xiaomi.com. (40)
03:05:07.198388 eth0  In  IP 37.25.86.42.62267 > 5.75.196.218.51820: UDP, length 112
03:05:07.198406 wg0   In  IP 10.252.1.1.1149 > 1.1.1.1.53: 52376+ A? api.ad.intl.xiaomi.com. (40)
03:05:08.552437 eth0  In  IP 37.25.86.42.62267 > 5.75.196.218.51820: UDP, length 112
03:05:08.552512 wg0   In  IP 10.252.1.1.13788 > 1.1.1.1.53: 53782+ A? incoming.telemetry.mozilla.org. (48)
03:05:08.792438 eth0  In  IP 37.25.86.42.62267 > 5.75.196.218.51820: UDP, length 112
03:05:08.792527 wg0   In  IP 10.252.1.1.29037 > 8.8.8.8.53: 57669+ A? googleads.g.doubleclick.net. (45)
03:05:08.800455 eth0  In  IP 37.25.86.42.62267 > 5.75.196.218.51820: UDP, length 112
03:05:08.800499 wg0   In  IP 10.252.1.1.26365 > 8.8.8.8.53: 35687+ A? googleads.g.doubleclick.net. (45)
03:05:08.855396 eth0  In  IP 37.25.86.42.62267 > 5.75.196.218.51820: UDP, length 112
03:05:08.855454 wg0   In  IP 10.252.1.1.31070 > 8.8.8.8.53: 55727+ A? googleads.g.doubleclick.net. (45)
03:05:09.009574 eth0  Out IP 5.75.196.218.53090 > 49.12.212.136.443: Flags [P.], seq 3876:4845, ack 1005, win 6730, options [nop,nop,TS val 2474926295 ecr 1013771269], length 969
03:05:09.013534 eth0  In  IP 49.12.212.136.443 > 5.75.196.218.53090: Flags [P.], seq 1005:1256, ack 4845, win 10106, options [nop,nop,TS val 1013774266 ecr 2474926295], length 251
03:05:09.013568 eth0  Out IP 5.75.196.218.53090 > 49.12.212.136.443: Flags [.], ack 1256, win 6730, options [nop,nop,TS val 2474926299 ecr 1013774266], length 0
03:05:09.562426 eth0  In  IP 37.25.86.42.62267 > 5.75.196.218.51820: UDP, length 112
03:05:09.562495 wg0   In  IP 10.252.1.1.63054 > 1.1.1.1.53: 7262+ A? googleads.g.doubleclick.net. (45)
03:05:09.932425 eth0  In  IP 37.25.86.42.62267 > 5.75.196.218.51820: UDP, length 112
03:05:09.932480 wg0   In  IP 10.252.1.1.61455 > 1.1.1.1.53: 12026+ A? safebrowsing.googleapis.com. (45)
03:05:10.912398 eth0  In  IP 37.25.86.42.62267 > 5.75.196.218.51820: UDP, length 96
03:05:10.912460 wg0   In  IP 10.252.1.1.6431 > 1.1.1.1.53: 19563+ A? www.google.com. (32)
03:05:11.035438 eth0  In  IP 37.25.86.42.62267 > 5.75.196.218.51820: UDP, length 160
```

**Comment by Janevski** [comment]
After adding:
`sudo iptables -P FORWARD ACCEPT`

and

`sudo iptables -t nat -A POSTROUTING -o eth0 -j MASQUERADE`

It started working since the second issue was a firewall and nat issue.
I must add that this is quite woknky and i'll have to find a better way. There must be an elegant solution to this.

**Comment by ByteDream** [comment]
> After adding: `sudo iptables -P FORWARD ACCEPT`
> 
> and
> 
> `sudo iptables -t nat -A POSTROUTING -o eth0 -j MASQUERADE`
> 
> It started working since the second issue was a firewall and nat issue. I must add that this is quite wonky and i'll have to find a better way. There must be an elegant solution to this.

I use iptables to address this issue too. You can set this as a `Post-Up`/`Post-Down` script in your wireguard config. This can also be done in wireguard-ui in the `Wireguard Server` section. I personally use `iptables -A FORWARD -i %1 -j ACCEPT; iptables -A FORWARD -o wg0 -j ACCEPT; iptables -t nat -A POSTROUTING -o eth+ -j MASQUERADE` (Post-Up) and `iptables -D FORWARD -i %1 -j ACCEPT; iptables -D FORWARD -o wg0 -j ACCEPT; iptables -t nat -D POSTROUTING -o eth+ -j MASQUERADE` (Post-Down) but you might change this iptables commands.

**Comment by Gamer08YT** [comment]
For me following worked:

- Editing docker-compose.yaml and changes following Enviroments:

```
  WGUI_MANAGE_START=false ->WGUI_MANAGE_START=true
  WGUI_MANAGE_RESTART=false -> WGUI_MANAGE_RESTART=true
```
